author,genre,imgURL,old_price,price,title
"Lê Hoành Phò, Trần Nam Dũng",reference-book,https://cdn0.fahasa.com/media/catalog/product/cache/1/thumbnail/66x/9df78eab33525d08d6e5fb8d27136e95/i/m/image_195509_1_47978.jpg,100.000,80.000,Tuyển Chọn Các Chuyên Đề Toán Phổ Thông - Tập 3
Đoàn Mạnh Linh,reference-book,https://cdn0.fahasa.com/media/catalog/product/cache/1/thumbnail/66x/9df78eab33525d08d6e5fb8d27136e95/i/m/image_195509_1_50144.jpg,239.000,147.000,3 Step - Tiết Lộ Bí Quyết 3 Bước Đạt Điểm 8+ Ngữ Văn
Nguyễn Xuân Nam,reference-book,https://cdn0.fahasa.com/media/catalog/product/cache/1/thumbnail/66x/9df78eab33525d08d6e5fb8d27136e95/i/m/image_220312.jpg,185.000,120.250,Mega 2021 - Siêu Luyện Đề 9+ THPT Quốc Gia 2021 Môn Toán Học
PGS TS Nguyễn Mạnh Hưởng,reference-book,https://cdn0.fahasa.com/media/catalog/product/cache/1/thumbnail/66x/9df78eab33525d08d6e5fb8d27136e95/i/m/image_197031.jpg,250.000,200.000,Đột Phá 8+ Môn Lịch Sử (Tái Bản 2020)
Nguyễn Văn Hòa,reference-book,https://cdn0.fahasa.com/media/catalog/product/cache/1/thumbnail/66x/9df78eab33525d08d6e5fb8d27136e95/9/7/9786049189494_1.jpg,10.000,9.000,Tóm Tắt Kiến Thức Toán 10-11-12 - Đại Số - Giải Tích
Nguyễn Thị Tuyết Mai,reference-book,https://cdn0.fahasa.com/media/catalog/product/cache/1/thumbnail/66x/9df78eab33525d08d6e5fb8d27136e95/i/m/image_195509_1_33943.jpg,148.000,111.000,Bứt Tốc Luyện Đề THPT QG 2020 - Môn Địa Lí
Nhiều Tác Giả,reference-book,https://cdn0.fahasa.com/media/catalog/product/cache/1/thumbnail/66x/9df78eab33525d08d6e5fb8d27136e95/i/m/image_197022.jpg,250.000,200.000,Đột Phá 8+ Môn Toán - Tập 1: Đại Số Và Giải Tích (Tái Bản 2020)
"Lê Hoành Phò, Trần Nam Dũng",reference-book,https://cdn0.fahasa.com/media/catalog/product/cache/1/thumbnail/66x/9df78eab33525d08d6e5fb8d27136e95/i/m/image_195509_1_47976.jpg,100.000,80.000,Tuyển Chọn Các Chuyên Đề Toán Phổ Thông - Tập 1
"Nguyễn Đức Quyền, TS Nguyễn Xuân Lạc",reference-book,https://cdn0.fahasa.com/media/catalog/product/cache/1/thumbnail/66x/9df78eab33525d08d6e5fb8d27136e95/i/m/image_195509_1_21652.jpg,85.000,68.000,Những Bài Văn Đạt Giải Quốc Gia
Nhiều Tác Giả,reference-book,https://cdn0.fahasa.com/media/catalog/product/cache/1/thumbnail/66x/9df78eab33525d08d6e5fb8d27136e95/i/m/image_222264.jpg,55.000,52.250,Hướng Dẫn Ôn Tập Tốt Nghiệp Trung Học Phổ Thông Quốc Gia Năm Học 2020 - 2021 Môn Ngữ Văn
Nhiều Tác Giả,reference-book,https://cdn0.fahasa.com/media/catalog/product/cache/1/thumbnail/66x/9df78eab33525d08d6e5fb8d27136e95/i/m/image_195509_1_29682.jpg,168.000,131.040,Bí Quyết Chinh Phục Điểm Cao Kì Thi THPT Quốc Gia Môn Ngữ Văn
Phạm Đức Bình,reference-book,https://cdn0.fahasa.com/media/catalog/product/cache/1/image/66x/9df78eab33525d08d6e5fb8d27136e95/i/m/image_145192.jpg,10.000,8.000,Cẩm Nang Sử Dụng Bảng Tuần Hoàn Các Nguyên Tố Hóa Học
Trần Văn Thanh,reference-book,https://cdn0.fahasa.com/media/catalog/product/cache/1/thumbnail/66x/9df78eab33525d08d6e5fb8d27136e95/m/e/mega_xoy_hoc_nhanh___23_phuong_phap_giai_hoa_hoc_hien_dai_1_2018_10_26_10_43_24.JPG,52.000,32.000,Mega XOY Học Nhanh - 23 Phương Pháp Giải Hóa Học Hiện Đại
Nhiều Tác Giả,reference-book,https://cdn0.fahasa.com/media/catalog/product/cache/1/thumbnail/66x/9df78eab33525d08d6e5fb8d27136e95/i/m/image_213791.jpg,180.000,144.000,Cấp Tốc 789+ Tổng Ôn Thi THPT Quốc Gia Môn Hóa
"Lê Hoành Phò, Trần Nam Dũng",reference-book,https://cdn0.fahasa.com/media/catalog/product/cache/1/thumbnail/66x/9df78eab33525d08d6e5fb8d27136e95/i/m/image_195509_1_47977.jpg,100.000,80.000,Tuyển Chọn Các Chuyên Đề Toán Phổ Thông - Tập 2
Trương Công Kiên,reference-book,https://cdn0.fahasa.com/media/catalog/product/cache/1/thumbnail/66x/9df78eab33525d08d6e5fb8d27136e95/i/m/image_195509_1_31110.jpg,199.000,159.200,Chinh Phục Vận Dụng Cao Sinh Học
Nguyễn Vũ,reference-book,https://cdn0.fahasa.com/media/catalog/product/cache/1/thumbnail/66x/9df78eab33525d08d6e5fb8d27136e95/c/a/cau_hoi_trac_nghiem_khach_quan_lich_su_lop_12_1_2018_09_04_16_17_07.JPG,55.000,44.000,Câu Hỏi Trắc Nghiệm Khách Quan Lịch Sử Lớp 12
Nguyễn Tất Thu,reference-book,https://cdn0.fahasa.com/media/catalog/product/cache/1/thumbnail/66x/9df78eab33525d08d6e5fb8d27136e95/1/8/18_chu_de_van_dung_van_dung_cao_toan_trac_nghiem_12_1_2018_08_31_16_44_23.JPG,130.000,97.500,18 Chủ Đề Vận Dụng & Vận Dụng Cao Toán Trắc Nghiệm 12
Trần Thị Đào,reference-book,https://cdn0.fahasa.com/media/catalog/product/cache/1/thumbnail/66x/9df78eab33525d08d6e5fb8d27136e95/5/5/554890634019.jpg,0.00,68.000,Kiến Thức Trọng Tâm Và Câu Hỏi Trắc Nghiệm Khách Quan Lịch Sử 12
Bitex,reference-book,https://cdn0.fahasa.com/media/catalog/product/cache/1/thumbnail/66x/9df78eab33525d08d6e5fb8d27136e95/i/m/image_195509_1_47035.jpg,165.000,132.000,Chinh Phục Đề Thi Toán Trung Học Phổ Thông Quốc Gia Bằng Máy Tín
Nhiều Tác Giả,reference-book,https://cdn0.fahasa.com/media/catalog/product/cache/1/thumbnail/66x/9df78eab33525d08d6e5fb8d27136e95/i/m/image_180728.jpg,108.000,48.600,Chiến Lược Luyện Thi THPT - Bộ Đề Thi Trắc Nghiệm - Khoa Học Xã Hội
Lê Quang Điệp,reference-book,https://cdn0.fahasa.com/media/catalog/product/cache/1/thumbnail/66x/9df78eab33525d08d6e5fb8d27136e95/i/m/image_195509_1_43642.jpg,30.000,24.000,Sổ Tay Công Thức Toán THPT
Nhiều Tác Giả,reference-book,https://cdn0.fahasa.com/media/catalog/product/cache/1/thumbnail/66x/9df78eab33525d08d6e5fb8d27136e95/i/m/image_195509_1_43122.jpg,39.000,37.050,Tiếng Anh 12 - Tập 2 - Sách Học Sinh (2020)
Nhiều Tác Giả,reference-book,https://cdn0.fahasa.com/media/catalog/product/cache/1/thumbnail/66x/9df78eab33525d08d6e5fb8d27136e95/i/m/image_195509_1_29677.jpg,168.000,131.040,Bí Quyết Chinh Phục Điểm Cao Kì Thi THPT Quốc Gia Môn Tiếng Anh
Nguyễn Văn Ninh,reference-book,https://cdn0.fahasa.com/media/catalog/product/cache/1/thumbnail/66x/9df78eab33525d08d6e5fb8d27136e95/i/m/image_221874.jpg,90.000,72.000,Bộ Đề Đánh Giá Năng Lực Môn Lịch Sử
Nhiều Tác Giả,reference-book,https://cdn0.fahasa.com/media/catalog/product/cache/1/thumbnail/66x/9df78eab33525d08d6e5fb8d27136e95/i/m/image_222260.jpg,70.000,66.500,Hướng Dẫn Ôn Tập Tốt Nghiệp Trung Học Phổ Thông Quốc Gia Năm Học 2020 - 2021 Khoa Học Xã Hội
Phạm Thị Thanh Thảo,reference-book,https://cdn0.fahasa.com/media/catalog/product/cache/1/thumbnail/66x/9df78eab33525d08d6e5fb8d27136e95/i/m/image_180164_1_43_1_57_1_4_1_2_1_210_1_29_1_98_1_25_1_21_1_5_1_3_1_18_1_18_1_45_1_26_1_32_1_14_1_587.jpg,189.000,138.915,Công Phá Lý Thuyết Sinh 10-11-12
Nhiều Tác Giả,reference-book,https://cdn0.fahasa.com/media/catalog/product/cache/1/thumbnail/66x/9df78eab33525d08d6e5fb8d27136e95/i/m/image_220307.jpg,535.000,330.000,Bộ Sách Khối A1 Mega 2021 - Siêu Luyện Đề 9+ THPT Quốc Gia Môn Toán - Lý - Anh (Bộ 3 Cuốn)
"Phan Huy Khải, Phạm Văn Thạo",reference-book,https://cdn0.fahasa.com/media/catalog/product/cache/1/thumbnail/66x/9df78eab33525d08d6e5fb8d27136e95/i/m/image_218690.jpg,45.000,36.000,Ôn Luyện Thi Tốt Nghiệp THPT Năm 2021 Môn Toán
TS Phan Khắc Nghệ,reference-book,https://cdn0.fahasa.com/media/catalog/product/cache/1/thumbnail/66x/9df78eab33525d08d6e5fb8d27136e95/i/m/image_195509_1_11442.jpg,80.000,64.000,Phương Pháp Giải Toán Xác Suất Sinh Học
"Nguyễn Mạnh Hưởng, Nguyễn Văn Ninh, Ngô Thị Hải Yến",reference-book,https://cdn0.fahasa.com/media/catalog/product/cache/1/thumbnail/66x/9df78eab33525d08d6e5fb8d27136e95/i/m/image_218694.jpg,65.000,52.000,Ôn Luyện Thi Tốt Nghiệp THPT Năm 2021 Bài Thi Khoa Học Xã Hội
"Nguyễn Hải Tiến, ThS Trần Dũng Hà",reference-book,https://cdn0.fahasa.com/media/catalog/product/cache/1/thumbnail/66x/9df78eab33525d08d6e5fb8d27136e95/i/m/image_96447.jpg,47.000,39.010,Phân Loại Và Phương Pháp Giải Các Dạng Bài Tập Sinh Học Lớp 12
Nhóm Bookgol,reference-book,https://cdn0.fahasa.com/media/catalog/product/cache/1/thumbnail/66x/9df78eab33525d08d6e5fb8d27136e95/i/m/image_195509_1_30132.jpg,178.000,133.500,Sketch Test Luyện Đề THPTQG 2020 - Môn Sinh Học
"Đinh Minh Hằng, Nguyễn Thu Hà, Vương Hiền, Nguyễn Đức An",reference-book,https://cdn0.fahasa.com/media/catalog/product/cache/1/thumbnail/66x/9df78eab33525d08d6e5fb8d27136e95/i/m/image_218691.jpg,45.000,36.000,Ôn Luyện Thi Tốt Nghiệp THPT Năm 2021 Môn Ngữ Văn
"Nguyễn Xuân Nam, Bùi Thị Lý Hạnh",reference-book,https://cdn0.fahasa.com/media/catalog/product/cache/1/thumbnail/66x/9df78eab33525d08d6e5fb8d27136e95/i/m/image_220314.jpg,165.000,107.250,Mega 2021 - Siêu Luyện Đề 9+ THPT Quốc Gia 2021 Môn Vật Lý
Đoàn Mạnh Linh,reference-book,https://cdn0.fahasa.com/media/catalog/product/cache/1/thumbnail/66x/9df78eab33525d08d6e5fb8d27136e95/i/m/image_220317.jpg,165.000,107.250,Mega 2021 - Siêu Luyện Đề 9+ THPT Quốc Gia 2021 Môn Văn Học
Nhiều Tác Giả,reference-book,https://cdn0.fahasa.com/media/catalog/product/cache/1/thumbnail/66x/9df78eab33525d08d6e5fb8d27136e95/i/m/image_222262.jpg,55.000,52.250,Hướng Dẫn Ôn Tập Tốt Nghiệp Trung Học Phổ Thông Quốc Gia Năm Học 2020 - 2021 Môn Toán
Dương Hương,reference-book,https://cdn0.fahasa.com/media/catalog/product/cache/1/thumbnail/66x/9df78eab33525d08d6e5fb8d27136e95/i/m/image_220316.jpg,185.000,120.250,Mega 2021 - Siêu Luyện Đề 9+ THPT Quốc Gia 2021 Môn Tiếng Anh
"Lê Tiến Hà, Phạm Thống, Lê Thị Thủy",reference-book,https://cdn0.fahasa.com/media/catalog/product/cache/1/thumbnail/66x/9df78eab33525d08d6e5fb8d27136e95/i/m/image_218693.jpg,65.000,52.000,Ôn Luyện Thi Tốt Nghiệp THPT Năm 2021 Bài Thi Khoa Học Tự Nhiên
"Trần Thị Yến, Lê Thị Thu Hiền",reference-book,https://cdn0.fahasa.com/media/catalog/product/cache/1/thumbnail/66x/9df78eab33525d08d6e5fb8d27136e95/i/m/image_220315.jpg,165.000,107.250,Mega 2021 - Siêu Luyện Đề 9+ THPT Quốc Gia 2021 Môn Hóa Học
Nhiều Tác Giả,reference-book,https://cdn0.fahasa.com/media/catalog/product/cache/1/thumbnail/66x/9df78eab33525d08d6e5fb8d27136e95/i/m/image_222261.jpg,65.000,61.750,Hướng Dẫn Ôn Tập Tốt Nghiệp Trung Học Phổ Thông Quốc Gia Năm Học 2020 - 2021 Môn Tiếng Anh
ThS Trần Văn Năng,reference-book,https://cdn0.fahasa.com/media/catalog/product/cache/1/thumbnail/66x/9df78eab33525d08d6e5fb8d27136e95/i/m/image_195509_1_30135.jpg,148.000,111.000,Bứt Tốc Luyện Đề THPTQG 2020 - Môn Giáo Dục Công Dân
Nguyễn Thúy Vinh,reference-book,https://cdn0.fahasa.com/media/catalog/product/cache/1/thumbnail/66x/9df78eab33525d08d6e5fb8d27136e95/c/a/cac_dang_cau_hoi_trac_nghiem_dia_ly_12_1_2018_09_04_16_18_32.JPG,53.000,39.750,Các Dạng Câu Hỏi Trắc Nghiệm Địa Lý 12
Nhiều Tác Giả,reference-book,https://cdn0.fahasa.com/media/catalog/product/cache/1/thumbnail/66x/9df78eab33525d08d6e5fb8d27136e95/i/m/image_195509_1_30131.jpg,199.000,149.250,Sketch Test Luyện Đề THPTQG 2020 - Môn Toán
Đỗ Ngọc Tiến,reference-book,https://cdn0.fahasa.com/media/catalog/product/cache/1/thumbnail/66x/9df78eab33525d08d6e5fb8d27136e95/i/m/image_195509_1_12481.jpg,109.000,87.200,Phát Triển Năng Lực Thi Trắc Nghiệm Môn Địa Lí
Nguyễn Đức Hiền,reference-book,https://cdn0.fahasa.com/media/catalog/product/cache/1/thumbnail/66x/9df78eab33525d08d6e5fb8d27136e95/1/0/100_bai_phan_tich_binh_giang___binh_luan_van_hoc_on_thi_thpt_quoc_gia_1_2018_08_23_15_32_38.JPG,75.000,56.250,"100 Bài Phân Tích Bình Giảng , Bình Luận Văn Học ( Ôn Thi Thpt Quốc Gia)"
"Lê Thị Mỹ Trinh, Nguyễn Thị Hương Trầm, Nguyễn Lê Ly Na",reference-book,https://cdn0.fahasa.com/media/catalog/product/cache/1/thumbnail/66x/9df78eab33525d08d6e5fb8d27136e95/c/h/chinh_phuc_ki_thi_thpt_quoc_gia_mon_ngu_van___127_bai_van_phan_tich_12_1_2018_08_23_09_55_25.JPG,96.000,72.000,Chinh Phục Kì Thi THPT Quốc Gia Môn Ngữ Văn - 127 Bài Văn Phân Tích 12
Trần Văn Thanh,reference-book,https://cdn0.fahasa.com/media/catalog/product/cache/1/thumbnail/66x/9df78eab33525d08d6e5fb8d27136e95/i/m/image_120289.jpg,149.000,111.750,Tuyệt Đỉnh Công Phá Đề Thi THPT Quốc Gia Hóa Học Chuyên Đề Lý Thuyết Hữu Cơ
Dương Thị Hương,reference-book,https://cdn0.fahasa.com/media/catalog/product/cache/1/thumbnail/66x/9df78eab33525d08d6e5fb8d27136e95/i/m/image_195509_1_50142.jpg,239.000,162.520,3 Step - Tiết Lộ Bí Quyết 3 Bước Đạt Điểm 8+ Tiếng Anh
"ThS Phạm Quốc Toản, ThS Bùi Xuân Dương",reference-book,https://cdn0.fahasa.com/media/catalog/product/cache/1/thumbnail/66x/9df78eab33525d08d6e5fb8d27136e95/b/i/bia-sketch-vatly-2.jpg,178.000,133.500,Sketch Test Luyện Đề THPTQG 2020 - Môn Vật Lí
Nhiều Tác Giả,reference-book,https://cdn0.fahasa.com/media/catalog/product/cache/1/thumbnail/66x/9df78eab33525d08d6e5fb8d27136e95/i/m/image_220306.jpg,1.030.000,669.500,Bộ Sách Mega 2021 - Siêu Luyện Đề 9+ THPT Quốc Gia Môn Toán - Lý - Hóa - Sinh - Anh - Văn (Bộ 6 Cuốn)
