author,genre,imgURL,old_price,price,title
"Makino Akiko, Tanaka Yone, Kitagawa Itsuko",japanese,https://cdn0.fahasa.com/media/catalog/product/cache/1/image/9df78eab33525d08d6e5fb8d27136e95/8/9/8934974147077_2.jpg,65.000,55.250,Tiếng Nhật Cho Mọi Người Trình Đô Sơ Cấp 1: 25 Bài Luyện Nghe (Kèm CD)
Thanh Xuân,japanese,https://cdn0.fahasa.com/media/catalog/product/cache/1/image/9df78eab33525d08d6e5fb8d27136e95/i/m/image_195509_1_33748.jpg,79.000,63.200,5500 Từ Vựng Tiếng Nhật Thông Dụng
The Sakura,japanese,https://cdn0.fahasa.com/media/catalog/product/cache/1/image/9df78eab33525d08d6e5fb8d27136e95/i/m/image_182442.jpg,65.000,48.750,Tập Viết Tiếng Nhật Bảng Chữ Cái Hiragana
Minna no Nihonggo,japanese,https://cdn0.fahasa.com/media/catalog/product/cache/1/image/9df78eab33525d08d6e5fb8d27136e95/i/m/image_176633.jpg,105.000,89.250,Tiếng Nhật Cho Mọi Người - Sơ Cấp 2 – Hán Tự (Bản Tiếng Việt) (Bản Mới)
Vương Tố Mai,japanese,https://cdn0.fahasa.com/media/catalog/product/cache/1/image/9df78eab33525d08d6e5fb8d27136e95/i/m/image_195509_1_32313.jpg,348.000,302.760,Mô Phỏng Đề Thi HSK - Phiên Bản Mới - Cấp Độ 6
The Sakura,japanese,https://cdn0.fahasa.com/media/catalog/product/cache/1/image/9df78eab33525d08d6e5fb8d27136e95/u/n/untitled-2_68_2.jpg,65.000,48.750,Tập Viết Tiếng Nhật Bảng Chữ Cái Katakana
The Japan Foundation,japanese,https://cdn0.fahasa.com/media/catalog/product/cache/1/image/9df78eab33525d08d6e5fb8d27136e95/k/a/katsudoo_1.jpg,160.000,108.800,Marugoto - Sơ Cấp 1 - A2 - Hoạt Động Giao Tiếp
Minna no Nihongo,japanese,https://cdn0.fahasa.com/media/catalog/product/cache/1/image/9df78eab33525d08d6e5fb8d27136e95/i/m/image_176631.jpg,75.000,60.000,Tiếng Nhật Cho Mọi Người - Sơ Cấp 1 - Bản Dịch Và Giải Thích Ngữ Pháp - Tiếng Việt (Bản Mới)
Nhiều tác giả,japanese,https://cdn0.fahasa.com/media/catalog/product/cache/1/image/9df78eab33525d08d6e5fb8d27136e95/i/m/image_180746.jpg,110.000,93.500,Luyện Thi Năng Lực Tiếng Nhật Tổng Hợp Từ Vựng N2 - JLPT N2
"Matsumoto, Sasaki Hitoko",japanese,https://cdn0.fahasa.com/media/catalog/product/cache/1/image/9df78eab33525d08d6e5fb8d27136e95/i/m/image_84216.jpg,78.000,66.300,500 Câu Hỏi Luyện Thi Năng Lực Nhật Ngữ Trình Độ N2
Arc Academy,japanese,https://cdn0.fahasa.com/media/catalog/product/cache/1/image/9df78eab33525d08d6e5fb8d27136e95/i/m/image_195509_1_26612.jpg,125.000,106.250,N1 - 3000 Từ Vựng Cần Thiết Cho Kỳ Thi Năng Lực Nhật Ngữ
Arc Academy,japanese,https://cdn0.fahasa.com/media/catalog/product/cache/1/image/9df78eab33525d08d6e5fb8d27136e95/i/m/image_195509_1_26608.jpg,115.000,97.750,N2 - 2500 Từ Vựng Cần Thiết Cho Kỳ Thi Năng Lực Nhật Ngữ
Arc Academy,japanese,https://cdn0.fahasa.com/media/catalog/product/cache/1/image/9df78eab33525d08d6e5fb8d27136e95/i/m/image_195509_1_26611.jpg,72.000,61.200,N5 - 1000 Từ Vựng Cần Thiết Cho Kỳ Thi Năng Lực Nhật Ngữ
The Japan Foundation,japanese,https://cdn0.fahasa.com/media/catalog/product/cache/1/image/9df78eab33525d08d6e5fb8d27136e95/m/a/marugoto_-_katsudoo-hd_giao_tiep_b_a_1.jpg,150.000,102.000,Marugoto A1 - Hoạt Động Giao Tiếp
Minh Tân,japanese,https://cdn0.fahasa.com/media/catalog/product/cache/1/image/9df78eab33525d08d6e5fb8d27136e95/t/_/t_-h_c-1000-ch_-kanji-trong-ti_ng-nh_t-95k.jpg,95.000,76.950,Tự Học 1000 Chữ Kanji Thông Dụng Trong Tiếng Nhật
Ryo Shimizu,japanese,https://cdn0.fahasa.com/media/catalog/product/cache/1/image/9df78eab33525d08d6e5fb8d27136e95/i/m/image_195509_1_24753.jpg,100.000,80.000,7000 Từ Vựng Tiếng Nhật Theo Chủ Đề
Nhóm tác giả,japanese,https://cdn0.fahasa.com/media/catalog/product/cache/1/image/9df78eab33525d08d6e5fb8d27136e95/i/m/image_113827.jpg,90.000,77.400,Giáo Trình Luyện Thi Năng Lực Tiếng Nhật Try! - N3 (Kèm 1 CD)
"Sasaki Hitoko, Matsumoto Noriko",japanese,https://cdn0.fahasa.com/media/catalog/product/cache/1/image/9df78eab33525d08d6e5fb8d27136e95/n/p/np.jpg,70.000,59.500,Luyện Thi Năng Lực Nhật Ngữ N1 – Ngữ Pháp
"Tomomatsu Etsuko, Fukushima Sachi, Nakamura Kaori",japanese,https://cdn0.fahasa.com/media/catalog/product/cache/1/image/9df78eab33525d08d6e5fb8d27136e95/i/m/image_195509_1_42796.jpg,95.000,71.250,Luyện Thi Năng Lực Tiếng Nhật N4 - Nghe Hiểu
"Masahiro Tanimori, Eriko Sato",japanese,https://cdn0.fahasa.com/media/catalog/product/cache/1/image/9df78eab33525d08d6e5fb8d27136e95/i/m/image_195509_1_41291.jpg,229.000,183.200,Ngữ Pháp Tiếng Nhật Căn Bản
The sakura,japanese,https://cdn0.fahasa.com/media/catalog/product/cache/1/image/9df78eab33525d08d6e5fb8d27136e95/b/i/bia_truoc-tu_hoc_tieng_nhat_danh_cho_nguoi_moi_bat_dau.png,105.000,78.750,Tự Học Tiếng Nhật Cho Người Mới Bắt Đầu (Tái Bản 2018)
Eriko Sato,japanese,https://cdn0.fahasa.com/media/catalog/product/cache/1/image/9df78eab33525d08d6e5fb8d27136e95/i/m/image_65015.jpg,60.000,40.800,Tự Học Viết Tiếng Nhật 200 Chữ Kanji Căn Bản (Tập 1)
Nhóm tác giả,japanese,https://cdn0.fahasa.com/media/catalog/product/cache/1/image/9df78eab33525d08d6e5fb8d27136e95/i/m/image_113829.jpg,95.000,81.700,Giáo Trình Luyện Thi Năng Lực Tiếng Nhật Try! - N1 (Kèm 1 CD)
SASAKI HITOKO & MATSUMOTO NORIKO,japanese,https://cdn0.fahasa.com/media/catalog/product/cache/1/image/9df78eab33525d08d6e5fb8d27136e95/i/m/image_195509_1_8463.jpg,65.000,55.250,"Luyện Thi Năng Lực Nhật Ngữ N4: Ngữ Pháp, Đọc Hiểu, Nghe Hiểu"
Nguyễn Vân Anh (Asahi),japanese,https://cdn0.fahasa.com/media/catalog/product/cache/1/image/9df78eab33525d08d6e5fb8d27136e95/i/m/image_144373.jpg,75.000,60.000,Tự Học Tiếng Nhật Cấp Tốc Trong 30 Ngày
"AOTS, The Association For Overseas Technical Scholarship",japanese,https://cdn0.fahasa.com/media/catalog/product/cache/1/image/9df78eab33525d08d6e5fb8d27136e95/i/m/image_180870.jpg,68.000,55.080,Sách Tự Học Hiragana Katakana - Học Thông Qua Nghe Và Viết
Nhóm tác giả,japanese,https://cdn0.fahasa.com/media/catalog/product/cache/1/image/9df78eab33525d08d6e5fb8d27136e95/i/m/image_113828.jpg,95.000,76.950,Giáo Trình Luyện Thi Năng Lực Tiếng Nhật Try! - N2 (Kèm 1 CD)
Thiên Phúc,japanese,https://cdn0.fahasa.com/media/catalog/product/cache/1/image/9df78eab33525d08d6e5fb8d27136e95/i/m/image_139789.jpg,62.000,40.300,Hướng Dẫn Đọc Và Viết Tiếng Nhật
"Sasaki Hitoko, Matsumoto Noriko",japanese,https://cdn0.fahasa.com/media/catalog/product/cache/1/image/9df78eab33525d08d6e5fb8d27136e95/i/m/image_195509_1_29273.jpg,70.000,59.500,Luyện Thi Năng Lực Nhật Ngữ N3 - Từ Vựng (Tái Bản 2020)
NXB Trẻ,japanese,https://cdn0.fahasa.com/media/catalog/product/cache/1/image/9df78eab33525d08d6e5fb8d27136e95/i/m/image_84210.jpg,62.000,52.700,Luyện Thi Năng Lực Nhật Ngữ Trình Độ N2 - Từ Vựng
Mai Ngọc,japanese,https://cdn0.fahasa.com/media/catalog/product/cache/1/image/9df78eab33525d08d6e5fb8d27136e95/8/9/8935236408479.jpg,48.000,37.440,Tập Viết Tiếng Nhật Căn Bản Kanji
NXB Trẻ,japanese,https://cdn0.fahasa.com/media/catalog/product/cache/1/image/9df78eab33525d08d6e5fb8d27136e95/i/m/image_84213.jpg,50.000,42.500,Luyện Thi Năng Lực Nhật Ngữ Trình Độ N2 - Đọc Hiểu
Arc Academy,japanese,https://cdn0.fahasa.com/media/catalog/product/cache/1/image/9df78eab33525d08d6e5fb8d27136e95/i/m/image_195509_1_26609.jpg,110.000,93.500,N3 - 2000 Từ Vựng Cần Thiết Cho Kỳ Thi Năng Lực Nhật Ngữ
Mai Ngọc (chủ biên),japanese,https://cdn0.fahasa.com/media/catalog/product/cache/1/image/9df78eab33525d08d6e5fb8d27136e95/i/m/image_180054.jpg,44.000,35.200,Tập Viết Tiếng Nhật Căn Bản Katakana (Tái Bản 2018)
Mai Ngọc,japanese,https://cdn0.fahasa.com/media/catalog/product/cache/1/image/9df78eab33525d08d6e5fb8d27136e95/t/_/t_p_viet_ti_ng_nh_t_c_n_b_n_39k_t_i_b_n_.png,39.000,33.150,Tập Viết Tiếng Nhật Căn Bản Hiragana (Tái Bản 2018)
"SASAKI HITOKO, MATSUMOTO NORIKO",japanese,https://cdn0.fahasa.com/media/catalog/product/cache/1/image/9df78eab33525d08d6e5fb8d27136e95/i/m/image_195509_1_7960.jpg,60.000,51.000,"Luyện Thi Năng Lực Nhật Ngữ N4. Hán Tự, Từ Vựng"
Nhiều Tác Giả,japanese,https://cdn0.fahasa.com/media/catalog/product/cache/1/image/9df78eab33525d08d6e5fb8d27136e95/8/9/8935246929094.jpg,161.000,120.750,Luyện Thi Năng Lực Tiếng Nhật N3 - Đọc Hiểu
Megumi,japanese,https://cdn0.fahasa.com/media/catalog/product/cache/1/image/9df78eab33525d08d6e5fb8d27136e95/i/m/image_184795.jpg,95.000,76.000,Bài Tập Ngữ Pháp Tiếng Nhật Hiện Đại - Sơ Cấp (Tái Bản)
Nhiều Tác Giả,japanese,https://cdn0.fahasa.com/media/catalog/product/cache/1/image/9df78eab33525d08d6e5fb8d27136e95/i/m/image_195509_1_32298.jpg,146.000,109.500,Luyện Thi Năng Lực Tiếng Nhật N3 - Ngữ Pháp
JBAA,japanese,https://cdn0.fahasa.com/media/catalog/product/cache/1/image/9df78eab33525d08d6e5fb8d27136e95/i/m/image_195509_1_4943.jpg,105.000,84.000,Giáo Trình Chính Thức - Kỳ Thi Chứng Nhận Năng Lực Ứng Xử Trong Doanh Nghiệp Nhật Bản (Cấp Độ 4)
Nhóm tác giả,japanese,https://cdn0.fahasa.com/media/catalog/product/cache/1/image/9df78eab33525d08d6e5fb8d27136e95/i/m/image_113826.jpg,90.000,77.400,Giáo Trình Luyện Thi Năng Lực Tiếng Nhật Try! - N4 (Kèm 1 CD)
Minna no Nihonggo,japanese,https://cdn0.fahasa.com/media/catalog/product/cache/1/image/9df78eab33525d08d6e5fb8d27136e95/i/m/image_176634.jpg,95.000,80.750,Tiếng Nhật Cho Mọi Người - Sơ Cấp 1 – Hán Tự (Bản Tiếng Việt) (Bản Mới)
Cao Lê Dung Chi,japanese,https://cdn0.fahasa.com/media/catalog/product/cache/1/image/9df78eab33525d08d6e5fb8d27136e95/i/m/image_86555.jpg,98.000,85.260,Đàm Thoại Tiếng Nhật - Làm Việc Trong Doanh Nghiệp Nhật Bản  (Kèm CD MP3)
Minna no Nihongo,japanese,https://cdn0.fahasa.com/media/catalog/product/cache/1/image/9df78eab33525d08d6e5fb8d27136e95/n/x/nxbtre_full_27572018_105715.jpg,70.000,56.000,Tiếng Nhật Cho Mọi Người - Sơ Cấp 2 - Bản Dịch Và Giải Thích Ngữ Pháp - Tiếng Việt (Bản Mới)
Minna no Nihongo,japanese,https://cdn0.fahasa.com/media/catalog/product/cache/1/image/9df78eab33525d08d6e5fb8d27136e95/s/o/so-cap-1_ban-tieng-nhat.jpg,145.000,116.000,Tiếng Nhật Cho Mọi Người - Sơ Cấp 1 - Bản Tiếng Nhật (Bản Mới)
The Japan Foundation,japanese,https://cdn0.fahasa.com/media/catalog/product/cache/1/image/9df78eab33525d08d6e5fb8d27136e95/r/i/rikai.jpg,160.000,108.800,Marugoto - Sơ Cấp 1 - A2 - Hiểu Biết Ngôn Ngữ
Minna no Nihongo,japanese,https://cdn0.fahasa.com/media/catalog/product/cache/1/image/9df78eab33525d08d6e5fb8d27136e95/i/m/image_176635.jpg,45.000,38.250,Tiếng Nhật Cho Mọi Người - Trình Độ Sơ Cấp 1 - Tổng Hợp Các Bài Tập Chủ Điểm (Bản Mới)
Eriko Sato,japanese,https://cdn0.fahasa.com/media/catalog/product/cache/1/image/9df78eab33525d08d6e5fb8d27136e95/i/m/image_76249.jpg,60.000,40.800,Tự Học Viết Tiếng Nhật - 200 Chữ Kanji Căn Bản (Tập 2)
Mai Hương,japanese,https://cdn0.fahasa.com/media/catalog/product/cache/1/image/9df78eab33525d08d6e5fb8d27136e95/i/m/image_192621_1.jpg,50.000,40.000,Từ Vựng Tiếng Nhật Theo Chủ Đề (Tái Bản)
"Thanh Xuân, Vân Anh",japanese,https://cdn0.fahasa.com/media/catalog/product/cache/1/image/9df78eab33525d08d6e5fb8d27136e95/i/m/image_195509_1_15681.jpg,135.000,109.350,Học Tiếng Nhật Không Khó - Từ Vựng
"Mai Ngọc, Vân Anh",japanese,https://cdn0.fahasa.com/media/catalog/product/cache/1/image/9df78eab33525d08d6e5fb8d27136e95/i/m/image_221267.jpg,52.000,41.600,Tập Viết Tiếng Nhật Căn Bản - Kanji (Tái Bản 2021)
Nhiều Tác Giả,japanese,https://cdn0.fahasa.com/media/catalog/product/cache/1/image/9df78eab33525d08d6e5fb8d27136e95/s/o/so-cap-2_ban-tieng-nhat.jpg,145.000,116.000,Tiếng Nhật Cho Mọi Người - Sơ Cấp 2 - Bản Tiếng Nhật (Bản Mới 2018)
"Sasaki Hitoko, Matsumoto Noriko",japanese,https://cdn0.fahasa.com/media/catalog/product/cache/1/image/9df78eab33525d08d6e5fb8d27136e95/i/m/image_195509_1_49919.jpg,70.000,59.500,Luyện Thi Năng Lực Nhật Ngữ N3 - Đọc Hiểu (Tái Bản 2020)
"Sasaki Hitoko, Matsumoto Noriko",japanese,https://cdn0.fahasa.com/media/catalog/product/cache/1/image/9df78eab33525d08d6e5fb8d27136e95/i/m/image_195509_1_25870.jpg,65.000,55.250,Luyện Thi Năng Lực Nhật Ngữ N3 – Nghe Hiểu (Kèm Đĩa Cd)
Hà Thiện Thuyên,japanese,https://cdn0.fahasa.com/media/catalog/product/cache/1/image/9df78eab33525d08d6e5fb8d27136e95/i/m/image_141340.jpg,45.000,39.150,Tiếng Nhật Dành Cho Trẻ Em - Tập 1
The Sakura,japanese,https://cdn0.fahasa.com/media/catalog/product/cache/1/image/9df78eab33525d08d6e5fb8d27136e95/i/m/image_195509_1_30678.jpg,94.000,70.500,28 Ngày Tự Học Tiếng Nhật - Ghi Chú Luyện Viết - Sách Bài Tập
"Hà Nguyên, Tuyết Nhung",japanese,https://cdn0.fahasa.com/media/catalog/product/cache/1/image/9df78eab33525d08d6e5fb8d27136e95/i/m/image_112373.jpg,65.000,50.700,Tiếng Nhật Trong Cuộc Sống Hàng Ngày (Kèm CD) (Tái Bản)
Thiên Phúc ,japanese,https://cdn0.fahasa.com/media/catalog/product/cache/1/image/9df78eab33525d08d6e5fb8d27136e95/i/m/image_138206.jpg,52.000,33.800,Học Tiếng Nhật Cấp Tốc
Minh Tân,japanese,https://cdn0.fahasa.com/media/catalog/product/cache/1/image/9df78eab33525d08d6e5fb8d27136e95/i/m/image_186578.jpg,105.000,84.000,Luyện Viết Chữ Kanji
Kim Học Lệ,japanese,https://cdn0.fahasa.com/media/catalog/product/cache/1/image/9df78eab33525d08d6e5fb8d27136e95/i/m/image_219416.jpg,248.000,198.400,Mô Phỏng Đề Thi HSK - Phiên Bản Mới - Cấp Độ 3
NXB Trẻ,japanese,https://cdn0.fahasa.com/media/catalog/product/cache/1/image/9df78eab33525d08d6e5fb8d27136e95/i/m/image_195509_1_1453.jpg,65.000,55.250,Luyện Thi Năng Lực Nhật Ngữ N1 - Đọc Hiểu
Châu Thùy Trang,japanese,https://cdn0.fahasa.com/media/catalog/product/cache/1/image/9df78eab33525d08d6e5fb8d27136e95/i/m/image_195509_1_30079.jpg,70.000,56.000,Từ Vựng Cho Người Thi Topik
The Japan Foundation,japanese,https://cdn0.fahasa.com/media/catalog/product/cache/1/image/9df78eab33525d08d6e5fb8d27136e95/m/a/marugoto---rikai---hieu-biet-ngon-ngu_b_a_1.jpg,150.000,102.000,Marugoto A1 - Hiểu Biết Ngôn Ngữ
"Sasaki Hitoko, Matsumoto Noriko",japanese,https://cdn0.fahasa.com/media/catalog/product/cache/1/image/9df78eab33525d08d6e5fb8d27136e95/i/m/image_195509_1_29718.jpg,70.000,59.500,Luyện Thi Năng Lực Nhật Ngữ N3 - Hán Tự (Tái Bản 2019)
Japan Foundation,japanese,https://cdn0.fahasa.com/media/catalog/product/cache/1/image/9df78eab33525d08d6e5fb8d27136e95/i/m/image_195509_1_12631.jpg,160.000,108.800,Ngôn Ngữ Và Văn Hóa Nhật Bản - Hoạt Động Giao Tiếp A2 -  Sơ Cấp 2
Hoàng Quỳnh,japanese,https://cdn0.fahasa.com/media/catalog/product/cache/1/image/9df78eab33525d08d6e5fb8d27136e95/i/m/image_195509_1_62.jpg,105.000,84.000,Ngữ Pháp Tiếng Nhật Hiện Đại - Sơ Cấp ( Tái Bản)
Kozakura,japanese,https://cdn0.fahasa.com/media/catalog/product/cache/1/image/9df78eab33525d08d6e5fb8d27136e95/i/m/image_195509_1_41187.jpg,95.000,57.000,Chinh Phục Tiếng Nhật - Tập Viết Chữ Hiragana Và Katakana
Đức Minh,japanese,https://cdn0.fahasa.com/media/catalog/product/cache/1/image/9df78eab33525d08d6e5fb8d27136e95/8/3/83a81ccf105ef400ad4f.jpg,58.000,37.700,Sổ Tay Ngữ Pháp Tiếng Nhật
Thảo Nguyên,japanese,https://cdn0.fahasa.com/media/catalog/product/cache/1/image/9df78eab33525d08d6e5fb8d27136e95/i/m/image_191887.jpg,95.000,66.500,Tự Học Tiếng Nhật Căn Bản Trình Độ Sơ Cấp (Tái Bản 2019)
"Yamazaki Yoshiko, Ishii Reiko, Sasaki Kaoru, Takahashi Miwako, Machida Keiko",japanese,https://cdn0.fahasa.com/media/catalog/product/cache/1/image/9df78eab33525d08d6e5fb8d27136e95/i/m/image_180164_1_43_1_57_1_4_1_2_1_210_1_29_1_56.jpg,70.000,52.500,Giáo Trình Tiếng Nhật Daichi Sơ Cấp 1 - Bài Tập Tổng Hợp
"Choi Chunghui, Machida Goyuki, Park Minyeong",japanese,https://cdn0.fahasa.com/media/catalog/product/cache/1/image/9df78eab33525d08d6e5fb8d27136e95/i/m/image_195509_1_11239.jpg,185.000,138.750,Tiếng Nhật Thật Đơn Giản Trong Giao Tiếp Hàng Ngày - Sơ Cấp 2
Thu Trang,japanese,https://cdn0.fahasa.com/media/catalog/product/cache/1/image/9df78eab33525d08d6e5fb8d27136e95/i/m/image_180164_1_43_1_57_1_4_1_2_1_210_1_29_1_98_1_25_1_21_1_5_1_3_1_18_1_18_1_45_1_26_1_32_1_14_1_1131.jpg,90.000,76.500,Tập Viết 800 Chữ Kanji Thông Dụng Trong Tiếng Nhật - Tập 1
Nhiều Tác Giả,japanese,https://cdn0.fahasa.com/media/catalog/product/cache/1/image/9df78eab33525d08d6e5fb8d27136e95/i/m/image_195509_1_24523.jpg,95.000,80.750,Tiếng Nhật Cho Mọi Người - Trình Độ Sơ Cấp 2 (Bản Tiếng Nhật)- Tái bản
"Mariko Matsuura, Kenji Suzuki",japanese,https://cdn0.fahasa.com/media/catalog/product/cache/1/image/9df78eab33525d08d6e5fb8d27136e95/i/m/image_195509_1_12795.jpg,60.000,48.600,Bộ Đề Luyện Thi Năng Lực Tiếng Nhật N3 - Kanji Từ Vựng
Hoàng Khang,japanese,https://cdn0.fahasa.com/media/catalog/product/cache/1/image/9df78eab33525d08d6e5fb8d27136e95/i/m/image_195509_1_9043.jpg,79.000,59.250,Ngữ Pháp Tiếng Nhật Căn Bản N5
NXB Hồng Đức,japanese,https://cdn0.fahasa.com/media/catalog/product/cache/1/image/9df78eab33525d08d6e5fb8d27136e95/g/i/giao-trinh-tieng-nhat_1_1.jpg,142.000,106.500,Giáo Trình Tiếng Nhật Sơ Cấp (Tập 2) - SHIN NIHONGO NO KISO II
Arc Academy,japanese,https://cdn0.fahasa.com/media/catalog/product/cache/1/image/9df78eab33525d08d6e5fb8d27136e95/i/m/image_195509_1_26610.jpg,78.000,66.300,N4 - 1500 Từ Vựng Cần Thiết Cho Kỳ Thi Năng Lực Nhật Ngữ
Megumi,japanese,https://cdn0.fahasa.com/media/catalog/product/cache/1/image/9df78eab33525d08d6e5fb8d27136e95/i/m/image_195509_1_28312.jpg,100.000,80.000,Hikari - 10 Phút Tự Học Tiếng Nhật Mỗi Ngày (Sách Màu Kèm Tải File Cd Đính Kèm) - Tái Bản
"Kit Pancoast Nagamura, Kyoko Tsuchiya",japanese,https://cdn0.fahasa.com/media/catalog/product/cache/1/image/9df78eab33525d08d6e5fb8d27136e95/t/t/tthongdungnew4-_recovered_.jpg,138.000,93.840,1800 Câu Đàm Thoại Tiếng Nhật Thông Dụng
Thảo Nguyên,japanese,https://cdn0.fahasa.com/media/catalog/product/cache/1/image/9df78eab33525d08d6e5fb8d27136e95/i/m/image_138906.jpg,36.000,23.400,Tập Viết Tiếng Nhật Hiragana
Nhiều Tác Giả,japanese,https://cdn0.fahasa.com/media/catalog/product/cache/1/image/9df78eab33525d08d6e5fb8d27136e95/i/m/image_64648.jpg,99.000,66.330,Từ Điển Việt - Nhật
Bìa Mềm,japanese,https://cdn0.fahasa.com/media/catalog/product/cache/1/image/9df78eab33525d08d6e5fb8d27136e95/i/m/image_190981.jpg,45.000,31.500,Từ Vựng Tiếng Nhật N5
"Yamazaki Yoshiko, Ishii Reiko, Sasaki Kaoru, Takahashi Miwako, Machida Keiko",japanese,https://cdn0.fahasa.com/media/catalog/product/cache/1/image/9df78eab33525d08d6e5fb8d27136e95/i/m/image_180164_1_43_1_57_1_4_1_2_1_210_1_29_1_57.jpg,165.000,123.750,Giáo Trình Tiếng Nhật Daichi Sơ Cấp 2
"Miyazaki Michiko, Goshi Sachiko",japanese,https://cdn0.fahasa.com/media/catalog/product/cache/1/image/9df78eab33525d08d6e5fb8d27136e95/i/m/image_195509_1_51985.jpg,134.000,107.200,Tự Học Tiếng Nhật Thương Mại Trong 30 Giờ
Trường Nhật ngữ Quốc tế KCP,japanese,https://cdn0.fahasa.com/media/catalog/product/cache/1/image/9df78eab33525d08d6e5fb8d27136e95/i/m/image_195509_1_32156.jpg,146.000,99.280,15 Phút Luyện Kanji Mỗi Ngày - Vol 1
